id;name;remark;created_by;created_date
1;mobile Fish;Home Loan Account Table Computer;Trace;2019-06-04T18:45:57
2;Metal deposit;Producer;Implementation Electronics Officer;2019-06-04T11:57:19
3;Home Loan Account;web-readiness;Namibia;2019-06-04T17:10:41
4;Gorgeous Frozen Pants;Common;Savings Account syndicate Planner;2019-06-04T15:34:21
5;HDD;Table Small Frozen Sausages Planner;envisioneer Music Public-key;2019-06-04T20:59:24
6;Bahamian Dollar Investment Account;Games Regional Digitized;copy convergence;2019-06-04T21:47:03
7;Georgia Industrial;connect Markets Chief;capacitor archive;2019-06-04T13:05:03
8;Aruba;software scale interactive;Louisiana Specialist Home Loan Account;2019-06-04T20:09:03
9;scalable;Small;deliverables reinvent 24 hour;2019-06-05T02:26:12
10;magenta monitor 1080p;Unbranded Plastic Tuna Frozen;generating Highway Ergonomic;2019-06-04T17:52:30
